id,title,description,time,source
1,israeli attacks intensify across gaza strip amid evacuation orders,,,https://www.dawn.com/
2,canada arrests fourth indian national in killing of sikh activist,,,https://www.dawn.com/
3,second night of auroras seen amid extreme solar storm,,,https://www.dawn.com/
4,adb links support with imf s clean chit,,,https://www.dawn.com/
5,govt hints at raising wheat purchase target,,,https://www.dawn.com/
6,kp governor cm gandapur exchange threats in acrid spat,,,https://www.dawn.com/
7,seven security personnel martyred in north waziristan,,,https://www.dawn.com/
8,opposition plans fresh campaign to protect constitution,,,https://www.dawn.com/
9,uae hits out at netanyahu for saying it may help run gaza,,,https://www.dawn.com/
10,formation of na standing panels still in limbo,,,https://www.dawn.com/
11,is pti ready to apologise for may th ,,,https://www.dawn.com/
12,what on earth does the government want from us ,,,https://www.dawn.com/
13,how israel s killer robots in gaza are redefining automated warfare ,,,https://www.dawn.com/
14,top news stories pakistan s lunar mission,,,https://www.dawn.com/
15,why are israel and its western allies on the edge over icc arrest warrants ,,,https://www.dawn.com/
16,may ,,,https://www.dawn.com/
17,top news stories modi aggression in kashmir,,,https://www.dawn.com/
18,americans are upset over us supporting violence against palestinians,,,https://www.dawn.com/
19,concerns that modi s rhetoric might incite further violence against indian muslims are increasing,,,https://www.dawn.com/
20,may the day karachi went berserk,,,https://www.dawn.com/
21,fifa s foul on pakistan football,,,https://www.dawn.com/
22,who can rock the hybrid boat ,,,https://www.dawn.com/
23,looming pension crisis cries out for corrective measures,,,https://www.dawn.com/
24,smokers corner khan and the generals,,,https://www.dawn.com/
25,editorial it is imperative for the state to reconsider its approach to human rights,,,https://www.dawn.com/
26,love knows no boundaries at karachi s edhi home nursery for special children,,,https://www.dawn.com/
27,sindh s riverine region in the crosshairs of militia violence,,,https://www.dawn.com/
28,how the insurgency in balochistan is evolving,,,https://www.dawn.com/
29,editorial tax reforms must go beyond milking the salaried classes and pensioners,,,https://www.dawn.com/
30,to draw or not to draw,,,https://www.dawn.com/
31,pakistan s moment of youth,,,https://www.dawn.com/
32,pakistan s icube qamar beams back first images from moon s orbit,,,https://www.dawn.com/
33,ruling coalition loses reserved seats in punjab,,,https://www.dawn.com/
34,pia staff forgets to put boy s body on plane,,,https://www.dawn.com/
35,downside risks for pakistan remain exceptionally high imf,,,https://www.dawn.com/
36,pakistan remain unbeaten in azlan shah cup as match with new zealand ends in tie,,,https://www.dawn.com/
37,who can rock the hybrid boat ,,,https://www.dawn.com/
38,insurgency and social change,,,https://www.dawn.com/
39,indian elections,,,https://www.dawn.com/
40,overflowing cups,,,https://www.dawn.com/
41,the lethal troika,,,https://www.dawn.com/
42,a turbulent ,,,https://www.dawn.com/
43,a moral victory,,,https://www.dawn.com/
44,hope after defeat,,,https://www.dawn.com/
45,,,,https://www.dawn.com/
46,the net metering dead end,,,https://www.dawn.com/
47,education emergency,,,https://www.dawn.com/
48,waiting to practise,,,https://www.dawn.com/
49,most hated country in the world,,,https://www.dawn.com/
50,farmers march,,,https://www.dawn.com/
51,crisis of empathy,,,https://www.dawn.com/
52,adb links support with imf s clean chit,,,https://www.dawn.com/
53,areas of cooperation with saudi arabia identified pm shehbaz,,,https://www.dawn.com/
54,imf endorses status quo in sbp s policy rate,,,https://www.dawn.com/
55,exports to europe fall despite gsp ,,,https://www.dawn.com/
56,psx scales new highs on economic optimism,,,https://www.dawn.com/
57,ccp issues warnings to beauty brands,,,https://www.dawn.com/
58,fifa s foul on pakistan football,,,https://www.dawn.com/
59,bednarek storms to m triumph in doha neeraj chopra falls short,,,https://www.dawn.com/
60,real madrid eagerly awaits mbappe after psg exit confirmed,,,https://www.dawn.com/
61,djokovic bottle strike overshadows rome open cruise past moutet,,,https://www.dawn.com/
62,sultan azlan shah cup pakistan fall as dead sport recaptures audience once again,,,https://www.dawn.com/
63, england great anderson will make last test appearance in west indies clash,,,https://www.dawn.com/
64,second night of auroras seen amid extreme solar storm,,,https://www.dawn.com/
65,canada arrests fourth indian national in killing of sikh activist,,,https://www.dawn.com/
66,israel orders palestinians to evacuate from more areas of rafah,,,https://www.dawn.com/
67,uae hits out at netanyahu for saying it may help run gaza,,,https://www.dawn.com/
68,washington says use of its weapons by tel aviv in gaza violated law,,,https://www.dawn.com/
69,delhi cm kejriwal exhorts indians to resist dictatorship ,,,https://www.dawn.com/
70,men must take the lead in standing up against sexual harassment says hamza ali abbasi,,,https://www.dawn.com/
71,we asked moms what they want for mother s day no it isn t kurtas and candles,,,https://www.dawn.com/
72,going loco for local jugnu s chief saab candle is the ultimate karachi kid nostalgia,,,https://www.dawn.com/
73,fistula and child marriages the two epidemics plaguing women in gilgit baltistan,,,https://www.dawn.com/
74, elections what s at stake for india s minorities ,,,https://www.dawn.com/
75,from screens to streets how gen z is disrupting the status quo and redefining activism,,,https://www.dawn.com/
76,art group employs brainwaves ai to recreate landscapes,,,https://www.dawn.com/
77,pakistan s icube qamar beams back first images from moon s orbit,,,https://www.dawn.com/
78,people with two copies of a risk gene have genetic form of alzheimer s say scientists,,,https://www.dawn.com/
79,fifa s foul on pakistan football,,,https://www.dawn.com/
80,essay we re ready for your close up now,,,https://www.dawn.com/
81,football girls kicking mountains,,,https://www.dawn.com/
82,style all about my mother,,,https://www.dawn.com/
83,soundscape and now ai music,,,https://www.dawn.com/
84,the grapevine,,,https://www.dawn.com/
85,packaging film sector on the rise,,,https://www.dawn.com/
86,tax reforms easier than expected,,,https://www.dawn.com/
87,wheat s tricky procurement,,,https://www.dawn.com/
88,echoes of love,,,https://www.dawn.com/
89,mailbox,,,https://www.dawn.com/
90,mother s day a letter to my mum,,,https://www.dawn.com/
91,challenges working mothers face in the corporate sector,,,https://www.dawn.com/
92,samiya mumtaz to act commercially felt like i was selling my soul to earn but i put myself out there ,,,https://www.dawn.com/
93,how digitisation can affect agri financing,,,https://www.dawn.com/
94,state grid anhui electric power research institute uses digital tools to prevent floods,,,https://www.dawn.com/
95, zambia china culture and tourism year kicks off in beijing,,,https://www.dawn.com/
96,onus on us to stop gaza conflict and grant palestine full un membership,,,https://www.dawn.com/
97,state grid anhui electric power research institute uses digital tools to prevent floods,,,https://www.dawn.com/
98, zambia china culture and tourism year kicks off in beijing,,,https://www.dawn.com/
99,onus on us to stop gaza conflict and grant palestine full un membership,,,https://www.dawn.com/
1,israel orders more evacuations as rafah fighting intensifies,,,https://www.bbc.com/
